{
	"schemaVersion": "image-production-evaluation-v1",
	"experimentId": "affinity-workflow-v1",
	"generatedAt": "2026-08-30T05:26:47.455Z",
	"catalogHash": "f41daf73d81007493fa5bf49684202949a9bb983258f551fd502ac3411b49bab",
	"status": "incomplete",
	"controlled": {
		"targetCount": 24,
		"firstAttemptCandidateCount": 10,
		"speciesCorrectCount": 0,
		"affinityCorrectCount": 0,
		"normalUnaffiliatedCount": 0,
		"acceptedMeaningfulAffinityCount": 0,
		"acceptedCriticalVisualFailureCount": 0
	},
	"workflow": {
		"completedTargetCount": 60,
		"completeProvenanceCount": 60,
		"pathConflictCount": 0,
		"sharedFileEditCount": 0,
		"retryCeilingViolationCount": 0
	},
	"blindReviews": [],
	"concurrencyStages": [
		{
			"stage": "canary",
			"plannedParallelJobs": 2,
			"effectiveParallelJobs": 2,
			"targetCount": 2,
			"candidateCount": 2,
			"reviseCount": 0,
			"failedCount": 0,
			"throttleCount": 0,
			"timeoutCount": 0,
			"retryCount": 2,
			"generationMedianMs": 25527.5,
			"generationP90Ms": null,
			"generationP95Ms": null,
			"slowestCompletionMs": 202684,
			"waveWallTimeMs": 237612,
			"summedJobTimeMs": 371387,
			"effectiveSpeedup": 1.563,
			"parallelEfficiency": 0.7815,
			"queueDelayMs": null,
			"visualCandidateRate": 1,
			"provenanceCompletenessRate": 1,
			"missingResultCount": 0,
			"duplicateIdCount": 0,
			"pathConflictCount": 0,
			"integrationErrorCount": 0
		},
		{
			"stage": "pilot",
			"plannedParallelJobs": 4,
			"effectiveParallelJobs": 3,
			"targetCount": 3,
			"candidateCount": 3,
			"reviseCount": 0,
			"failedCount": 0,
			"throttleCount": 0,
			"timeoutCount": 0,
			"retryCount": 3,
			"generationMedianMs": 43165,
			"generationP90Ms": null,
			"generationP95Ms": null,
			"slowestCompletionMs": 218875,
			"waveWallTimeMs": 251214,
			"summedJobTimeMs": 628542,
			"effectiveSpeedup": 2.502,
			"parallelEfficiency": 0.834,
			"queueDelayMs": null,
			"visualCandidateRate": 1,
			"provenanceCompletenessRate": 1,
			"missingResultCount": 0,
			"duplicateIdCount": 0,
			"pathConflictCount": 0,
			"integrationErrorCount": 0
		},
		{
			"stage": "controlled",
			"plannedParallelJobs": 6,
			"effectiveParallelJobs": 3,
			"targetCount": 6,
			"candidateCount": 5,
			"reviseCount": 1,
			"failedCount": 0,
			"throttleCount": 0,
			"timeoutCount": 0,
			"retryCount": 5,
			"generationMedianMs": 21600,
			"generationP90Ms": 44834,
			"generationP95Ms": 47595,
			"slowestCompletionMs": 279175,
			"waveWallTimeMs": 621383,
			"summedJobTimeMs": 1149432,
			"effectiveSpeedup": 1.8498,
			"parallelEfficiency": 0.6166,
			"queueDelayMs": null,
			"visualCandidateRate": 0.8333,
			"provenanceCompletenessRate": 1,
			"missingResultCount": 0,
			"duplicateIdCount": 0,
			"pathConflictCount": 0,
			"integrationErrorCount": 0
		},
		{
			"stage": "controlled",
			"plannedParallelJobs": 6,
			"effectiveParallelJobs": 3,
			"targetCount": 3,
			"candidateCount": 2,
			"reviseCount": 1,
			"failedCount": 0,
			"throttleCount": 0,
			"timeoutCount": 0,
			"retryCount": 1,
			"generationMedianMs": 37985.5,
			"generationP90Ms": null,
			"generationP95Ms": null,
			"slowestCompletionMs": 240000,
			"waveWallTimeMs": 292745,
			"summedJobTimeMs": 538052,
			"effectiveSpeedup": 1.838,
			"parallelEfficiency": 0.6127,
			"queueDelayMs": null,
			"visualCandidateRate": 0.6667,
			"provenanceCompletenessRate": 1,
			"missingResultCount": 0,
			"duplicateIdCount": 0,
			"pathConflictCount": 0,
			"integrationErrorCount": 0
		}
	],
	"failureClassifications": [
		{
			"failureId": "death-knight-safe-margin-v1",
			"targetId": null,
			"layer": "skill",
			"description": "All six canonical-v1 Death Knight first attempts violated the explicit eight-percent safe-margin gate despite complete silhouettes.",
			"resolution": "Added the versioned safe-frame-v2 prompt protocol for ungenerated targets while preserving every completed pilot prompt hash. The first safe-frame-v2 Elemental passed framing without a retry."
		},
		{
			"failureId": "death-knight-affinity-overlay",
			"targetId": null,
			"layer": "species-grammar",
			"description": "Independent known-target audit found unstable command-seal and pennant grammar plus repeated base-armor-and-overlay affinity treatment; Metal was especially difficult to distinguish from Normal.",
			"resolution": "Metal v2 replaced the hidden ordinary body with a forged ribcage, metallic marrow, articulated joints, and a magnetic core. Metal v3 preserved that construction and passed the strict safe frame as a producer candidate; blind human distinction from Normal remains pending."
		},
		{
			"failureId": "elemental-stone-anchor-bias",
			"targetId": null,
			"layer": "species-grammar",
			"description": "Independent audit found that the Stone Breaker anchor biased every Bound Vanguard toward a raised head-like crown and stone substrate; Normal reads Earth, Water reads Ice, and Fire, Metal, and Wind often read as stone plus effects.",
			"resolution": "Create a purpose-built headless, materially neutral Bound Vanguard anchor and versioned Elemental regression targets with affinity-specific load-bearing substance rules."
		},
		{
			"failureId": "semantic-authoring-gates-v1",
			"targetId": null,
			"layer": "execution-contract",
			"description": "The basic-v1 authoring contract required framing and subject completion but allowed visually polished semantic failures to remain producer candidates.",
			"resolution": "Added semantic-v2 gates for manifest fidelity, real multi-dimensional affinity construction or unaffiliated Normal construction, and a visibly readable counterplay cue. Completed pilot targets retain basic-v1 for immutable provenance."
		},
		{
			"failureId": "grey-wolf-normal-empty-provider-output",
			"targetId": "affinity-workflow-v1-grey-wolf-normal",
			"layer": "generator-variance",
			"description": "The first Grey Wolf Normal generation returned no bindable image payload and consumed the sole retry.",
			"resolution": "The second call returned a verifiable candidate; retain the provider-failure attempt as evidence and do not generalize a new visual rule from one empty response."
		},
		{
			"failureId": "safe-frame-v3-lock-omission",
			"targetId": null,
			"layer": "skill",
			"description": "A fresh-agent audit found that safe-frame-v3 removed the terminal newline but accidentally omitted the documented central-84-percent framing lock, contributing to framing-only retries in the beast wave.",
			"resolution": "Preserved all dispatched v3 prompts as immutable provenance and introduced safe-frame-v4, which restores the central-canvas lock while retaining the no-terminal-LF handoff. Metal and Water Cave Bears passed v4 framing on their first attempts."
		},
		{
			"failureId": "correction-reference-provenance-v1",
			"targetId": "affinity-workflow-v1-cave-bear-wood",
			"layer": "execution-contract",
			"description": "The verifier conflated manifest reference provenance with the generated-image source used for a corrective edit, making a truthful correction record fail validation.",
			"resolution": "Defined ordered referenceInputs as inherited target provenance and correctionReferenceInput as the exact generated-image edit source path and hash; updated both contract and verifier, then verified the truthful Wood Bear revise result."
		},
		{
			"failureId": "active-agent-ceiling-3",
			"targetId": null,
			"layer": "scheduler",
			"description": "Local configuration requests 16 concurrent threads, but this live task exposes four total slots and therefore only three simultaneous image workers when orchestration is reserved.",
			"resolution": "Use three image workers as the safe ceiling in this environment. Run 8-, 12-, and 16-worker stages only in a newly provisioned task that exposes those slots; do not infer capacity from configuration alone."
		},
		{
			"failureId": "grey-wolf-fire-prompt-provenance-v1",
			"targetId": "affinity-workflow-v1-grey-wolf-fire",
			"layer": "execution-contract",
			"description": "The visually strong Fire Grey Wolf v1 remained revise because its submitted first prompt did not match the immutable canonical prompt bytes.",
			"resolution": "The versioned safe-frame-v4 semantic-v2 Fire Grey Wolf rerun passed on its first attempt with exact prompt and reference provenance."
		},
		{
			"failureId": "elemental-fire-safe-margin-v2",
			"targetId": "affinity-workflow-v1-elemental-fire-v2",
			"layer": "target",
			"description": "The improved substance-bodied Fire Elemental v2 retained a top-edge flame and smoke safe-margin failure.",
			"resolution": "Fire Elemental v3 preserved the headless shallow-concave plasma chassis and passed the central-84-percent framing gate on its first attempt."
		},
		{
			"failureId": "cave-bear-wind-paw-occlusion",
			"targetId": "affinity-workflow-v1-cave-bear-wind-v2",
			"layer": "generator-variance",
			"description": "The original Wind Cave Bear and both versioned v2 attempts hid the far hind paw despite explicit broadside-to-three-quarter stance and four-grounded-paw constraints.",
			"resolution": null
		},
		{
			"failureId": "result-verifier-retry-reason-parity",
			"targetId": "affinity-workflow-v1-death-knight-metal-v3",
			"layer": "execution-contract",
			"description": "The Python result verifier accepted an omitted nullable retryReason on an accepted corrective attempt, while the strict TypeScript schema rejected the record during aggregate sync.",
			"resolution": "Restored the explicit null in the result and tightened the reusable Python verifier to require retryReason on every attempt, matching the repository contract."
		}
	],
	"recommendedSafeConcurrency": 3,
	"completionNotes": [
		"Canary metrics cover Normal and Fire Death Knights at two effective workers. The partial Pilot covers Wood, Metal, and Water Death Knights at three effective workers under a four-job planned stage; the active task exposes four total slots and reserves one for orchestration.",